{
  "namespace": "https://id.example.com/org/acme",
  "instanceId": "inst_01",
  "agentId": "agt_01JABCDEF0000000000000000",
  "workloadRegistrationId": "wr_01",
  "workloadId": "spiffe://example.org/ns/acme/sa/agent",
  "attestationRef": "att_01",
  "credentialGeneration": 2,
  "leaseExpiresAt": "2026-09-22T11:00:00Z",
  "instanceState": "active"
}
